{
  "$schema": "./schemas/native-execution-payloads.schema.json",
  "schemaVersion": 1,
  "manifestId": "combat-canary-native-execution-payloads",
  "generatedAtUtc": "2026-07-19T21:21:04.2926215Z",
  "extensions": [
    ".bat",
    ".cmd",
    ".com",
    ".dll",
    ".exe",
    ".pyd"
  ],
  "ordinaryFileTrees": [
    {
      "id": "cmake",
      "pathRoot": "PROGRAMFILES",
      "relativeRoot": "CMake",
      "fileCount": 8818,
      "totalBytes": 143234583,
      "rootSha256": "688b73ba919513345ba4bc0b1ce3086e1b2af996cff786aa03eac8841dd517d7"
    },
    {
      "id": "git-for-windows",
      "pathRoot": "PROGRAMFILES",
      "relativeRoot": "Git",
      "fileCount": 9576,
      "totalBytes": 423145238,
      "rootSha256": "87db472fc3c2f8521a397257ae8f79d51052b4b16a7c3e99436a772b5da30978"
    },
    {
      "id": "gnupg",
      "pathRoot": "PROGRAMFILES",
      "relativeRoot": "GnuPG",
      "fileCount": 98,
      "totalBytes": 17478763,
      "rootSha256": "ec652be44962d1341aac192739af6aeee1566892797da30a68f38deec6b233b8"
    },
    {
      "id": "ninja",
      "pathRoot": "LOCALAPPDATA",
      "relativeRoot": "Microsoft/WinGet/Packages/Ninja-build.Ninja_Microsoft.Winget.Source_8wekyb3d8bbwe",
      "fileCount": 2,
      "totalBytes": 620032,
      "rootSha256": "6a10d3e7dfe918a0d00ac658603e8c3012c9b5c3f3ea5f31b8d4c974ce2632b4"
    },
    {
      "id": "winlibs",
      "pathRoot": "LOCALAPPDATA",
      "relativeRoot": "Microsoft/WinGet/Packages/BrechtSanders.WinLibs.POSIX.UCRT_Microsoft.Winget.Source_8wekyb3d8bbwe/mingw64",
      "fileCount": 11750,
      "totalBytes": 962598090,
      "rootSha256": "b3ed6539cebd84794e1cfa6fbc9944691e3504c4f02d1615fb9c7cdbaf86cd41"
    }
  ],
  "payloads": [
    {
      "id": "cmake",
      "pathRoot": "PROGRAMFILES",
      "relativeRoot": "CMake/bin",
      "fileCount": 5,
      "totalBytes": 77223800,
      "files": [
        {
          "path": "cmake-gui.exe",
          "size": 33878608,
          "sha256": "bda9a4284fe219f6585b75d4152481f2b6391ec78fe7c791b10fa41274d02f57"
        },
        {
          "path": "cmake.exe",
          "size": 13465160,
          "sha256": "4510f1883dfad3238602bae9a7a4b441fb4a931a643604aa44336710b6be5f6f"
        },
        {
          "path": "cmcldeps.exe",
          "size": 1902160,
          "sha256": "406759ec666b92f00494d1c8831b1073e32da53c02bd1da976d59c04f343e901"
        },
        {
          "path": "cpack.exe",
          "size": 13537864,
          "sha256": "8cd50e08846dafcb9e3851dcb654f4888624f2953cfb5278e4b8c31cafdc6500"
        },
        {
          "path": "ctest.exe",
          "size": 14440008,
          "sha256": "b3fcab80b6f4155ea1312380e7f7d4e463b16a975c991d8d599176f410fa3754"
        }
      ]
    },
    {
      "id": "git-for-windows",
      "pathRoot": "PROGRAMFILES",
      "relativeRoot": "Git",
      "fileCount": 693,
      "totalBytes": 307149318,
      "files": [
        {
          "path": "bin/bash.exe",
          "size": 47448,
          "sha256": "a80d0cc4ed45f99c6073e8504bcdd9935c553afd9460627cbbb4bec103e7ef60"
        },
        {
          "path": "bin/git.exe",
          "size": 46920,
          "sha256": "7b7971dd13f0c3a284e538601f2f9770b3a87dfaccb5fb52d68141c67ed22364"
        },
        {
          "path": "bin/sh.exe",
          "size": 47448,
          "sha256": "a80d0cc4ed45f99c6073e8504bcdd9935c553afd9460627cbbb4bec103e7ef60"
        },
        {
          "path": "cmd/git-gui.exe",
          "size": 138072,
          "sha256": "3ee7f7f36c582ae3b5b8010723e73dec378f6d1068ec2d4cc94bcdec71871c91"
        },
        {
          "path": "cmd/git-lfs.exe",
          "size": 46920,
          "sha256": "7b7971dd13f0c3a284e538601f2f9770b3a87dfaccb5fb52d68141c67ed22364"
        },
        {
          "path": "cmd/git-receive-pack.exe",
          "size": 32908,
          "sha256": "20b747a3fffa1065a5d463880efd7cb1fb9c3e89abb5e18ae45e77e75f9336a9"
        },
        {
          "path": "cmd/git-upload-pack.exe",
          "size": 32908,
          "sha256": "e1cca7ed444ab91ae99fc04c8071c9f690036881ba3d595f3bca6fa4362b2e18"
        },
        {
          "path": "cmd/git.exe",
          "size": 46920,
          "sha256": "7b7971dd13f0c3a284e538601f2f9770b3a87dfaccb5fb52d68141c67ed22364"
        },
        {
          "path": "cmd/gitk.exe",
          "size": 138056,
          "sha256": "3eb8af8a53027f52a1bc9fc296330697b361ac48d713a40b9f39363288b7388c"
        },
        {
          "path": "cmd/scalar.exe",
          "size": 46920,
          "sha256": "7b7971dd13f0c3a284e538601f2f9770b3a87dfaccb5fb52d68141c67ed22364"
        },
        {
          "path": "cmd/start-ssh-agent.cmd",
          "size": 2973,
          "sha256": "7e6c5f3dc6a4209dca0e1f38880b2978500a5c745c04bc60dbeda5fc48e8d3cb"
        },
        {
          "path": "cmd/start-ssh-pageant.cmd",
          "size": 2723,
          "sha256": "80b0b11efe5a2f9b4cd92f28c260d0b3aad8b809c34ed95237c59b73e08ade0b"
        },
        {
          "path": "cmd/tig.exe",
          "size": 47432,
          "sha256": "0f3a38c60d27f0cac0ca576ab6b47e324ef4b649544c522d1f052ef117a91c88"
        },
        {
          "path": "git-bash.exe",
          "size": 139080,
          "sha256": "bc84beb29fb77ac0fc98a4ae7806a6a6230cf63aab262aa9731582fa36bde589"
        },
        {
          "path": "git-cmd.exe",
          "size": 138568,
          "sha256": "4bfcc107687b1f6c60ecfb43fdde792970f2e64f2701689f66409b3dc994751e"
        },
        {
          "path": "mingw64/bin/Atlassian.Bitbucket.dll",
          "size": 105272,
          "sha256": "d03ac1bb85265ed202cd47e3ef862f4ec7d4e23f4d9ca63202f75e5c6d0b26d8"
        },
        {
          "path": "mingw64/bin/Avalonia.Base.dll",
          "size": 1922880,
          "sha256": "392c2b56b7e07e637dfb75782676722b534e51e2e7fdf648847748accfe8d9f0"
        },
        {
          "path": "mingw64/bin/Avalonia.Controls.dll",
          "size": 1032000,
          "sha256": "8c738676cba16b540da1f0ffe3e90a7e60ea1b557763093785add052f2f0e096"
        },
        {
          "path": "mingw64/bin/Avalonia.DesignerSupport.dll",
          "size": 218464,
          "sha256": "385a4549ce261e31f905db7c9ac21f6c397b10873ec29a68473d55139ff3c37c"
        },
        {
          "path": "mingw64/bin/Avalonia.Dialogs.dll",
          "size": 252768,
          "sha256": "660c8c15560314b54ecfe73c3287f837a2dfd02ed128f17fa50a74b09a40c6b7"
        },
        {
          "path": "mingw64/bin/Avalonia.Markup.Xaml.dll",
          "size": 92992,
          "sha256": "91ddf6050fb74d6a44eea6f863c376824090cc8568fd8af84da5e7455f05f891"
        },
        {
          "path": "mingw64/bin/Avalonia.Markup.dll",
          "size": 71008,
          "sha256": "ac255cb78ab548689cb62933b155035105444f34a5b0ef5ebd3542a95988cea1"
        },
        {
          "path": "mingw64/bin/Avalonia.Metal.dll",
          "size": 24416,
          "sha256": "153deb3c0fe47c044dd46e855ca1368ff376bfb3f8719c63457a8c39fb9bf2db"
        },
        {
          "path": "mingw64/bin/Avalonia.MicroCom.dll",
          "size": 25408,
          "sha256": "bc018651648d1ef3da247cef78d5a9d27cb05146c635c193f42bff147a58dd39"
        },
        {
          "path": "mingw64/bin/Avalonia.OpenGL.dll",
          "size": 106336,
          "sha256": "40480a32e90e6ad337aa1e69787bd3cd15830416f8b99e2c44fdc634ab3451bf"
        },
        {
          "path": "mingw64/bin/Avalonia.Remote.Protocol.dll",
          "size": 82752,
          "sha256": "3d493f4597d67e8dfe135be0f3b110d47f752150d355c5afd26b2c0fe683e3ca"
        },
        {
          "path": "mingw64/bin/Avalonia.Skia.dll",
          "size": 133440,
          "sha256": "63349f9586d7442885658fec139d2f49b8b7cc9168dfb8863b0d8afca9cc93db"
        },
        {
          "path": "mingw64/bin/Avalonia.Themes.Fluent.dll",
          "size": 579896,
          "sha256": "680fe2b42c264de4636ec6d43b4ffa35eed06d57b1b2d563706f8ad29a0bc315"
        },
        {
          "path": "mingw64/bin/Avalonia.Vulkan.dll",
          "size": 186168,
          "sha256": "482db3fb63b96f7a398d9b613299d0339321fe9c5c3777170ae3121c3ecd41b5"
        },
        {
          "path": "mingw64/bin/Avalonia.Win32.dll",
          "size": 745792,
          "sha256": "88acade75fe12b98320bbb8f689709b7e56f0a0bf100a8b7dff348feeb9cbd90"
        },
        {
          "path": "mingw64/bin/Avalonia.dll",
          "size": 14176,
          "sha256": "9ea0559b46f6fa746e6de4cd05349f6b4d48efc387af469fb73917d540784d84"
        },
        {
          "path": "mingw64/bin/GitHub.dll",
          "size": 154936,
          "sha256": "73c1a5f230c0a385f1a2869a32240197ab63b8397c2f78b15bb0e3ed95dd0009"
        },
        {
          "path": "mingw64/bin/GitLab.dll",
          "size": 71488,
          "sha256": "11c203b995828bcb95a4949886a717933323ef63e40154f13fd179ca22443503"
        },
        {
          "path": "mingw64/bin/HarfBuzzSharp.dll",
          "size": 215360,
          "sha256": "70f931c39b6ef652da09c6a8cb3827581b71da8bd8bb5e92e0f3f411571829f9"
        },
        {
          "path": "mingw64/bin/MicroCom.Runtime.dll",
          "size": 24384,
          "sha256": "0d55f1e0708318e06616b7e8d03c125a184de0e44eb2d4f52727f02b6efbec05"
        },
        {
          "path": "mingw64/bin/Microsoft.AzureRepos.dll",
          "size": 69472,
          "sha256": "4aced14747f4593be95e99b201b5c97a9e4ea76624ed905554795d235f0a977a"
        },
        {
          "path": "mingw64/bin/Microsoft.Bcl.AsyncInterfaces.dll",
          "size": 26432,
          "sha256": "ad14fdae478ec07ebaee5371c54960c51216d0f210d1c496a0804766a6b827ac"
        },
        {
          "path": "mingw64/bin/Microsoft.Identity.Client.Broker.dll",
          "size": 74048,
          "sha256": "52e5ccfcb00d9b39e05d140f27f8b7bea7f03b7493358c2008b1fedd69e6ae4d"
        },
        {
          "path": "mingw64/bin/Microsoft.Identity.Client.Extensions.Msal.dll",
          "size": 65376,